<?xml version="1.0" encoding="UTF-8" standalone="no"?>
<!DOCTYPE courselist SYSTEM "courselist.dtd">

<courselist>
	
	<subject>Svenska</subject>
	
	<course>
		<code>1SV108</code>
		<title>Akademiskt skrivande</title>
		<credits>7,5</credits>
		<description>I kursen utvecklar de studerande kunskap om och färdigheter i det vetenskapliga skrivandet.</description>
		<contact>
			<name>Claes Ohlsson</name>
			<email>claes.ohlsson@lnu.se</email>
		</contact>
		<moreinfo url="http://lnu.se/utbildning/kurser/1SV108"/>
	</course>
	
	<course>
		<code>1SV109</code>
		<title>Vikingarnas språk</title>
		<credits>7,5</credits>
		<description>Språket i det vikingatida Sverige utifrån bevarat källmaterial och med utblick mot hela Skandinavien.</description>
		<contact>
			<name>Claes Ohlsson</name>
			<email>claes.ohlsson@lnu.se</email>
		</contact>
		<moreinfo url="http://lnu.se/utbildning/kurser/1SV109"/>
	</course>
	
	<course>
		<code>1SV208</code>
		<title>Grammatik för lärare</title>
		<credits>7,5</credits>
		<description>Grammatik och grammatikdidaktik med fokus på att väcka förståelse och intresse för språkets struktur.</description>
		<moreinfo url="http://lnu.se/utbildning/kurser/1SV208"/>
	</course>
	
</courselist>
